Sheet: vel_000063
A1: 0 | B1: 0 | C1: 0 | D1: 0 | E1: 0 | F1: 0 | G1: 0
A2: =+R[-1]C+1 -> 1 | B2: 1 | C2: 1 | D2: 1 | E2: -1 | F2: -1 | G2: 1
A3: =+R[-1]C+1 -> 2 | B3: 1 | C3: 1 | D3: 0 | E3: -1 | F3: 0 | G3: 1
A4: =+R[-1]C+1 -> 3 | B4: 1 | C4: 0.33329999999999999 | D4: -0.33329999999999999 | E4: -0.33329999999999999 | F4: 0.33329999999999999 | G4: 1
A5: =+R[-1]C+1 -> 4 | B5: 0.5 | C5: 0 | D5: 0 | E5: 0 | F5: 0.5 | G5: 1
A6: =+R[-1]C+1 -> 5 | B6: 0.2 | C6: 0.2 | D6: 0.2 | E6: 0.2 | F6: 0.6 | G6: 0.6
A7: =+R[-1]C+1 -> 6 | B7: 0.33329999999999999 | C7: 0.33329999999999999 | D7: 0.33329999999999999 | E7: 0.33329999999999999 | F7: 0.33329999999999999 | G7: 0.33329999999999999
A8: =+R[-1]C+1 -> 7 | B8: 0.42859999999999998 | C8: 0.42859999999999998 | D8: 0.42859999999999998 | E8: 0.1429 | F8: 0.1429 | G8: 0.42859999999999998
A9: =+R[-1]C+1 -> 8 | B9: 0.5 | C9: 0.5 | D9: 0.25 | E9: 0 | F9: 0.25 | G9: 0.5
A10: =+R[-1]C+1 -> 9 | B10: 0.55559999999999998 | C10: 0.33329999999999999 | D10: 0.1111 | E10: 0.1111 | F10: 0.33329999999999999 | G10: 0.55559999999999998
A11: =+R[-1]C+1 -> 10 | B11: 0.4 | C11: 0.2 | D11: 0.2 | E11: 0.2 | F11: 0.4 | G11: 0.6
A12: =+R[-1]C+1 -> 11 | B12: 0.2727 | C12: 0.2727 | D12: 0.2727 | E12: 0.2727 | F12: 0.45450000000000002 | G12: 0.45450000000000002
A13: =+R[-1]C+1 -> 12 | B13: 0.33329999999999999 | C13: 0.33329999999999999 | D13: 0.33329999999999999 | E13: 0.33329999999999999 | F13: 0.33329999999999999 | G13: 0.33329999999999999
A14: =+R[-1]C+1 -> 13 | B14: 0.3846 | C14: 0.3846 | D14: 0.3846 | E14: 0.23080000000000001 | F14: 0.23080000000000001 | G14: 0.3846
A15: =+R[-1]C+1 -> 14 | B15: 0.42859999999999998 | C15: 0.42859999999999998 | D15: 0.28570000000000001 | E15: 0.1429 | F15: 0.28570000000000001 | G15: 0.42859999999999998
A16: =+R[-1]C+1 -> 15 | B16: 0.4667 | C16: 0.33329999999999999 | D16: 0.2 | E16: 0.2 | F16: 0.33329999999999999 | G16: 0.4667
A17: =+R[-1]C+1 -> 16 | B17: 0.375 | C17: 0.25 | D17: 0.25 | E17: 0.25 | F17: 0.375 | G17: 0.5
A18: =+R[-1]C+1 -> 17 | B18: 0.29409999999999997 | C18: 0.29409999999999997 | D18: 0.29409999999999997 | E18: 0.29409999999999997 | F18: 0.4118 | G18: 0.4118
A19: =+R[-1]C+1 -> 18 | B19: 0.33329999999999999 | C19: 0.33329999999999999 | D19: 0.33329999999999999 | E19: 0.33329999999999999 | F19: 0.33329999999999999 | G19: 0.33329999999999999
A20: =+R[-1]C+1 -> 19 | B20: 0.36840000000000001 | C20: 0.36840000000000001 | D20: 0.36840000000000001 | E20: 0.26319999999999999 | F20: 0.26319999999999999 | G20: 0.36840000000000001
A21: =+R[-1]C+1 -> 20 | B21: 0.4 | C21: 0.4 | D21: 0.3 | E21: 0.2 | F21: 0.3 | G21: 0.4
A22: =+R[-1]C+1 -> 21 | B22: 0.42859999999999998 | C22: 0.33329999999999999 | D22: 0.23810000000000001 | E22: 0.23810000000000001 | F22: 0.33329999999999999 | G22: 0.42859999999999998
A23: =+R[-1]C+1 -> 22 | B23: 0.36359999999999998 | C23: 0.2727 | D23: 0.2727 | E23: 0.2727 | F23: 0.36359999999999998 | G23: 0.45450000000000002
A24: =+R[-1]C+1 -> 23 | B24: 0.30430000000000001 | C24: 0.30430000000000001 | D24: 0.30430000000000001 | E24: 0.30430000000000001 | F24: 0.39129999999999998 | G24: 0.39129999999999998
A25: =+R[-1]C+1 -> 24 | B25: 0.33329999999999999 | C25: 0.33329999999999999 | D25: 0.33329999999999999 | E25: 0.33329999999999999 | F25: 0.33329999999999999 | G25: 0.33329999999999999
A26: =+R[-1]C+1 -> 25 | B26: 0.36 | C26: 0.36 | D26: 0.36 | E26: 0.28 | F26: 0.28 | G26: 0.36
A27: =+R[-1]C+1 -> 26 | B27: 0.3846 | C27: 0.3846 | D27: 0.30769999999999997 | E27: 0.23080000000000001 | F27: 0.30769999999999997 | G27: 0.3846
A28: =+R[-1]C+1 -> 27 | B28: 0.40739999999999998 | C28: 0.33329999999999999 | D28: 0.25929999999999997 | E28: 0.25929999999999997 | F28: 0.33329999999999999 | G28: 0.40739999999999998
A29: =+R[-1]C+1 -> 28 | B29: 0.35709999999999997 | C29: 0.28570000000000001 | D29: 0.28570000000000001 | E29: 0.28570000000000001 | F29: 0.35709999999999997 | G29: 0.42859999999999998
A30: =+R[-1]C+1 -> 29 | B30: 0.31030000000000002 | C30: 0.31030000000000002 | D30: 0.31030000000000002 | E30: 0.31030000000000002 | F30: 0.37930000000000003 | G30: 0.37930000000000003
A31: =+R[-1]C+1 -> 30 | B31: 0.33329999999999999 | C31: 0.33329999999999999 | D31: 0.33329999999999999 | E31: 0.33329999999999999 | F31: 0.33329999999999999 | G31: 0.33329999999999999
A32: =+R[-1]C+1 -> 31 | B32: 0.3548 | C32: 0.3548 | D32: 0.3548 | E32: 0.2903 | F32: 0.2903 | G32: 0.3548
A33: =+R[-1]C+1 -> 32 | B33: 0.375 | C33: 0.375 | D33: 0.3125 | E33: 0.25 | F33: 0.3125 | G33: 0.375
A34: =+R[-1]C+1 -> 33 | B34: 0.39389999999999997 | C34: 0.33329999999999999 | D34: 0.2727 | E34: 0.2727 | F34: 0.33329999999999999 | G34: 0.39389999999999997
A35: =+R[-1]C+1 -> 34 | B35: 0.35289999999999999 | C35: 0.29409999999999997 | D35: 0.29409999999999997 | E35: 0.29409999999999997 | F35: 0.35289999999999999 | G35: 0.4118
A36: =+R[-1]C+1 -> 35 | B36: 0.31430000000000002 | C36: 0.31430000000000002 | D36: 0.31430000000000002 | E36: 0.31430000000000002 | F36: 0.37140000000000001 | G36: 0.37140000000000001
A37: =+R[-1]C+1 -> 36 | B37: 0.33329999999999999 | C37: 0.33329999999999999 | D37: 0.33329999999999999 | E37: 0.33329999999999999 | F37: 0.33329999999999999 | G37: 0.33329999999999999
A38: =+R[-1]C+1 -> 37 | B38: 0.35139999999999999 | C38: 0.35139999999999999 | D38: 0.35139999999999999 | E38: 0.29730000000000001 | F38: 0.29730000000000001 | G38: 0.35139999999999999
A39: =+R[-1]C+1 -> 38 | B39: 0.36840000000000001 | C39: 0.36840000000000001 | D39: 0.31580000000000003 | E39: 0.26319999999999999 | F39: 0.31580000000000003 | G39: 0.36840000000000001
A40: =+R[-1]C+1 -> 39 | B40: 0.3846 | C40: 0.33329999999999999 | D40: 0.28210000000000002 | E40: 0.28210000000000002 | F40: 0.33329999999999999 | G40: 0.3846
A41: =+R[-1]C+1 -> 40 | B41: 0.35 | C41: 0.3 | D41: 0.3 | E41: 0.3 | F41: 0.35 | G41: 0.4
A42: =+R[-1]C+1 -> 41 | B42: 0.31709999999999999 | C42: 0.31709999999999999 | D42: 0.31709999999999999 | E42: 0.31709999999999999 | F42: 0.3659 | G42: 0.3659
A43: =+R[-1]C+1 -> 42 | B43: 0.33329999999999999 | C43: 0.33329999999999999 | D43: 0.33329999999999999 | E43: 0.33329999999999999 | F43: 0.33329999999999999 | G43: 0.33329999999999999
A44: =+R[-1]C+1 -> 43 | B44: 0.3488 | C44: 0.3488 | D44: 0.3488 | E44: 0.30230000000000001 | F44: 0.30230000000000001 | G44: 0.3488
A45: =+R[-1]C+1 -> 44 | B45: 0.36359999999999998 | C45: 0.36359999999999998 | D45: 0.31819999999999998 | E45: 0.2727 | F45: 0.31819999999999998 | G45: 0.36359999999999998
A46: =+R[-1]C+1 -> 45 | B46: 0.37780000000000002 | C46: 0.33329999999999999 | D46: 0.28889999999999999 | E46: 0.28889999999999999 | F46: 0.33329999999999999 | G46: 0.37780000000000002
A47: =+R[-1]C+1 -> 46 | B47: 0.3478 | C47: 0.30430000000000001 | D47: 0.30430000000000001 | E47: 0.30430000000000001 | F47: 0.3478 | G47: 0.39129999999999998
A48: =+R[-1]C+1 -> 47 | B48: 0.31909999999999999 | C48: 0.31909999999999999 | D48: 0.31909999999999999 | E48: 0.31909999999999999 | F48: 0.36170000000000002 | G48: 0.36170000000000002
A49: =+R[-1]C+1 -> 48 | B49: 0.33329999999999999 | C49: 0.33329999999999999 | D49: 0.33329999999999999 | E49: 0.33329999999999999 | F49: 0.33329999999999999 | G49: 0.33329999999999999
A50: =+R[-1]C+1 -> 49 | B50: 0.34689999999999999 | C50: 0.34689999999999999 | D50: 0.34689999999999999 | E50: 0.30609999999999998 | F50: 0.30609999999999998 | G50: 0.34689999999999999
A51: =+R[-1]C+1 -> 50 | B51: 0.36 | C51: 0.36 | D51: 0.32 | E51: 0.28 | F51: 0.32 | G51: 0.36
A52: =+R[-1]C+1 -> 51 | B52: 0.3725 | C52: 0.33329999999999999 | D52: 0.29409999999999997 | E52: 0.29409999999999997 | F52: 0.33329999999999999 | G52: 0.3725
A53: =+R[-1]C+1 -> 52 | B53: 0.34620000000000001 | C53: 0.30769999999999997 | D53: 0.30769999999999997 | E53: 0.30769999999999997 | F53: 0.34620000000000001 | G53: 0.3846
A54: =+R[-1]C+1 -> 53 | B54: 0.32079999999999997 | C54: 0.32079999999999997 | D54: 0.32079999999999997 | E54: 0.32079999999999997 | F54: 0.35849999999999999 | G54: 0.35849999999999999
A55: =+R[-1]C+1 -> 54 | B55: 0.33329999999999999 | C55: 0.33329999999999999 | D55: 0.33329999999999999 | E55: 0.33329999999999999 | F55: 0.33329999999999999 | G55: 0.33329999999999999
A56: =+R[-1]C+1 -> 55 | B56: 0.34549999999999997 | C56: 0.34549999999999997 | D56: 0.34549999999999997 | E56: 0.30909999999999999 | F56: 0.30909999999999999 | G56: 0.34549999999999997
A57: =+R[-1]C+1 -> 56 | B57: 0.35709999999999997 | C57: 0.35709999999999997 | D57: 0.32140000000000002 | E57: 0.28570000000000001 | F57: 0.32140000000000002 | G57: 0.35709999999999997
A58: =+R[-1]C+1 -> 57 | B58: 0.36840000000000001 | C58: 0.33329999999999999 | D58: 0.29820000000000002 | E58: 0.29820000000000002 | F58: 0.33329999999999999 | G58: 0.36840000000000001
A59: =+R[-1]C+1 -> 58 | B59: 0.3448 | C59: 0.31030000000000002 | D59: 0.31030000000000002 | E59: 0.31030000000000002 | F59: 0.3448 | G59: 0.37930000000000003
A60: =+R[-1]C+1 -> 59 | B60: 0.32200000000000001 | C60: 0.32200000000000001 | D60: 0.32200000000000001 | E60: 0.32200000000000001 | F60: 0.35589999999999999 | G60: 0.35589999999999999
A61: =+R[-1]C+1 -> 60 | B61: 0.33329999999999999 | C61: 0.33329999999999999 | D61: 0.33329999999999999 | E61: 0.33329999999999999 | F61: 0.33329999999999999 | G61: 0.33329999999999999
A62: =+R[-1]C+1 -> 61 | B62: 0.34429999999999999 | C62: 0.34429999999999999 | D62: 0.34429999999999999 | E62: 0.3115 | F62: 0.3115 | G62: 0.34429999999999999
A63: =+R[-1]C+1 -> 62 | B63: 0.3548 | C63: 0.3548 | D63: 0.3226 | E63: 0.2903 | F63: 0.3226 | G63: 0.3548
A64: =+R[-1]C+1 -> 63 | B64: 0.36509999999999998 | C64: 0.33329999999999999 | D64: 0.30159999999999998 | E64: 0.30159999999999998 | F64: 0.33329999999999999 | G64: 0.36509999999999998
A65: =+R[-1]C+1 -> 64 | B65: 0.34379999999999999 | C65: 0.3125 | D65: 0.3125 | E65: 0.3125 | F65: 0.34379999999999999 | G65: 0.375
A66: =+R[-1]C+1 -> 65 | B66: 0.3231 | C66: 0.3231 | D66: 0.3231 | E66: 0.3231 | F66: 0.3538 | G66: 0.3538
A67: =+R[-1]C+1 -> 66 | B67: 0.33329999999999999 | C67: 0.33329999999999999 | D67: 0.33329999999999999 | E67: 0.33329999999999999 | F67: 0.33329999999999999 | G67: 0.33329999999999999
A68: =+R[-1]C+1 -> 67 | B68: 0.34329999999999999 | C68: 0.34329999999999999 | D68: 0.34329999999999999 | E68: 0.31340000000000001 | F68: 0.31340000000000001 | G68: 0.34329999999999999
A69: =+R[-1]C+1 -> 68 | B69: 0.35289999999999999 | C69: 0.35289999999999999 | D69: 0.32350000000000001 | E69: 0.29409999999999997 | F69: 0.32350000000000001 | G69: 0.35289999999999999
A70: =+R[-1]C+1 -> 69 | B70: 0.36230000000000001 | C70: 0.33329999999999999 | D70: 0.30430000000000001 | E70: 0.30430000000000001 | F70: 0.33329999999999999 | G70: 0.36230000000000001
A71: =+R[-1]C+1 -> 70 | B71: 0.34289999999999998 | C71: 0.31430000000000002 | D71: 0.31430000000000002 | E71: 0.31430000000000002 | F71: 0.34289999999999998 | G71: 0.37140000000000001
A72: =+R[-1]C+1 -> 71 | B72: 0.32390000000000002 | C72: 0.32390000000000002 | D72: 0.32390000000000002 | E72: 0.32390000000000002 | F72: 0.35210000000000002 | G72: 0.35210000000000002
A73: =+R[-1]C+1 -> 72 | B73: 0.33329999999999999 | C73: 0.33329999999999999 | D73: 0.33329999999999999 | E73: 0.33329999999999999 | F73: 0.33329999999999999 | G73: 0.33329999999999999
A74: =+R[-1]C+1 -> 73 | B74: 0.34250000000000003 | C74: 0.34250000000000003 | D74: 0.34250000000000003 | E74: 0.31509999999999999 | F74: 0.31509999999999999 | G74: 0.34250000000000003
A75: =+R[-1]C+1 -> 74 | B75: 0.35139999999999999 | C75: 0.35139999999999999 | D75: 0.32429999999999998 | E75: 0.29730000000000001 | F75: 0.32429999999999998 | G75: 0.35139999999999999
A76: =+R[-1]C+1 -> 75 | B76: 0.36 | C76: 0.33329999999999999 | D76: 0.30669999999999997 | E76: 0.30669999999999997 | F76: 0.33329999999999999 | G76: 0.36
A77: =+R[-1]C+1 -> 76 | B77: 0.34210000000000002 | C77: 0.31580000000000003 | D77: 0.31580000000000003 | E77: 0.31580000000000003 | F77: 0.34210000000000002 | G77: 0.36840000000000001
A78: =+R[-1]C+1 -> 77 | B78: 0.32469999999999999 | C78: 0.32469999999999999 | D78: 0.32469999999999999 | E78: 0.32469999999999999 | F78: 0.35060000000000002 | G78: 0.35060000000000002
A79: =+R[-1]C+1 -> 78 | B79: 0.33329999999999999 | C79: 0.33329999999999999 | D79: 0.33329999999999999 | E79: 0.33329999999999999 | F79: 0.33329999999999999 | G79: 0.33329999999999999
A80: =+R[-1]C+1 -> 79 | B80: 0.34179999999999999 | C80: 0.34179999999999999 | D80: 0.34179999999999999 | E80: 0.3165 | F80: 0.3165 | G80: 0.34179999999999999
A81: =+R[-1]C+1 -> 80 | B81: 0.35 | C81: 0.35 | D81: 0.32500000000000001 | E81: 0.3 | F81: 0.32500000000000001 | G81: 0.35
A82: =+R[-1]C+1 -> 81 | B82: 0.35799999999999998 | C82: 0.33329999999999999 | D82: 0.30859999999999999 | E82: 0.30859999999999999 | F82: 0.33329999999999999 | G82: 0.35799999999999998
A83: =+R[-1]C+1 -> 82 | B83: 0.34150000000000003 | C83: 0.31709999999999999 | D83: 0.31709999999999999 | E83: 0.31709999999999999 | F83: 0.34150000000000003 | G83: 0.3659
A84: =+R[-1]C+1 -> 83 | B84: 0.32529999999999998 | C84: 0.32529999999999998 | D84: 0.32529999999999998 | E84: 0.32529999999999998 | F84: 0.34939999999999999 | G84: 0.34939999999999999
A85: =+R[-1]C+1 -> 84 | B85: 0.33329999999999999 | C85: 0.33329999999999999 | D85: 0.33329999999999999 | E85: 0.33329999999999999 | F85: 0.33329999999999999 | G85: 0.33329999999999999
A86: =+R[-1]C+1 -> 85 | B86: 0.3412 | C86: 0.3412 | D86: 0.3412 | E86: 0.31759999999999999 | F86: 0.31759999999999999 | G86: 0.3412
A87: =+R[-1]C+1 -> 86 | B87: 0.3488 | C87: 0.3488 | D87: 0.3256 | E87: 0.30230000000000001 | F87: 0.3256 | G87: 0.3488
A88: =+R[-1]C+1 -> 87 | B88: 0.35630000000000001 | C88: 0.33329999999999999 | D88: 0.31030000000000002 | E88: 0.31030000000000002 | F88: 0.33329999999999999 | G88: 0.35630000000000001
A89: =+R[-1]C+1 -> 88 | B89: 0.34089999999999998 | C89: 0.31819999999999998 | D89: 0.31819999999999998 | E89: 0.31819999999999998 | F89: 0.34089999999999998 | G89: 0.36359999999999998
A90: =+R[-1]C+1 -> 89 | B90: 0.32579999999999998 | C90: 0.32579999999999998 | D90: 0.32579999999999998 | E90: 0.32579999999999998 | F90: 0.3483 | G90: 0.3483
A91: =+R[-1]C+1 -> 90 | B91: 0.33329999999999999 | C91: 0.33329999999999999 | D91: 0.33329999999999999 | E91: 0.33329999999999999 | F91: 0.33329999999999999 | G91: 0.33329999999999999
A92: =+R[-1]C+1 -> 91 | B92: 0.3407 | C92: 0.3407 | D92: 0.3407 | E92: 0.31869999999999998 | F92: 0.31869999999999998 | G92: 0.3407
A93: =+R[-1]C+1 -> 92 | B93: 0.3478 | C93: 0.3478 | D93: 0.3261 | E93: 0.30430000000000001 | F93: 0.3261 | G93: 0.3478
A94: =+R[-1]C+1 -> 93 | B94: 0.3548 | C94: 0.33329999999999999 | D94: 0.31180000000000002 | E94: 0.31180000000000002 | F94: 0.33329999999999999 | G94: 0.3548
A95: =+R[-1]C+1 -> 94 | B95: 0.34039999999999998 | C95: 0.31909999999999999 | D95: 0.31909999999999999 | E95: 0.31909999999999999 | F95: 0.34039999999999998 | G95: 0.36170000000000002
A96: =+R[-1]C+1 -> 95 | B96: 0.32629999999999998 | C96: 0.32629999999999998 | D96: 0.32629999999999998 | E96: 0.32629999999999998 | F96: 0.34739999999999999 | G96: 0.34739999999999999
A97: =+R[-1]C+1 -> 96 | B97: 0.33329999999999999 | C97: 0.33329999999999999 | D97: 0.33329999999999999 | E97: 0.33329999999999999 | F97: 0.33329999999999999 | G97: 0.33329999999999999
A98: =+R[-1]C+1 -> 97 | B98: 0.3402 | C98: 0.3402 | D98: 0.3402 | E98: 0.3196 | F98: 0.3196 | G98: 0.3402
A99: =+R[-1]C+1 -> 98 | B99: 0.34689999999999999 | C99: 0.34689999999999999 | D99: 0.32650000000000001 | E99: 0.30609999999999998 | F99: 0.32650000000000001 | G99: 0.34689999999999999
A100: =+R[-1]C+1 -> 99 | B100: 0.35349999999999998 | C100: 0.33329999999999999 | D100: 0.31309999999999999 | E100: 0.31309999999999999 | F100: 0.33329999999999999 | G100: 0.35349999999999998